platform,storefront,app_id,review_id,date,user,rating,title,review,version,package,thumbsUpCount,appVersion
app_store,us,298867247.0,13508842862,2025-12-13T06:23:18-07:00,Mikedrod,1,Overpayment,"After months of autopay at the end of the month working well, Chase swept my checking account clean with an autopay mid month, without notice two weeks before Christmas for the entire card balance.  Nice!  Call for explanation and they can reverse it but I must wait days to do so and call back, navigate their phone tree, get a supervisor and explain again. Stay tuned. Of course they insist they didn’t change autopay settings. 

Chase gets a forced loan for billions of they do this widespread at year end so someone’s KPIs look awesome. Bonus paid, person credit rating (scam) damaged.",4.706,,,
app_store,us,298867247.0,13508707586,2025-12-13T05:44:03-07:00,Tae Tae9500,1,Disappointed,My money got scammed outta my account 2 times and I was just told to wait so I’m not even sure if I’ll be getting my money back either you might as well choose a different bank,4.706,,,
app_store,us,298867247.0,13508421512,2025-12-13T04:15:02-07:00,Chantie562,1,Charges,Don’t like the overdraft charges,4.706,,,
app_store,us,298867247.0,13507821303,2025-12-13T00:24:09-07:00,Juice-hunter,5,Where’s Kanye,Call me crazy or maybe I’m just thinking too much… but wasn’t there a story about the Epstein list being tied to J.P. Morgan.,4.706,,,
app_store,us,298867247.0,13507583563,2025-12-12T22:42:07-07:00,Amelfi González,5,🥰🥰🥰,Me fascina,4.706,,,
app_store,us,298867247.0,13507446151,2025-12-12T21:40:35-07:00,chre420710,5,Love this card,Simple and easy to understand love it great benefits and rewards,4.706,,,
app_store,us,298867247.0,13506623552,2025-12-12T16:09:42-07:00,Zoc Yahya,5,Yahya,Saleh,4.706,,,
app_store,us,298867247.0,13506375415,2025-12-12T14:31:04-07:00,Sheik Ur Bootie,1,Locked out of account again….,Unreal.  It’s like a recurring nightmare.  Why continuously lock my account? I have to call your endless ficki g doom loop of automated bs.  Stop!,4.706,,,
app_store,us,298867247.0,13506310636,2025-12-12T14:05:27-07:00,Cms325abc,1,Bad chase design,I don’t want paperless.    It tricked me.   And I can’t get out of it.   Horrible website,4.706,,,
app_store,us,298867247.0,13506062059,2025-12-12T12:29:28-07:00,Mr.D sp1784,1,Horrible morals,The way you treat your poorest and most vulnerable customers is utterly disgusting. Shame on everyone involved.,4.706,,,
app_store,us,298867247.0,13505953334,2025-12-12T11:49:05-07:00,Aadilعادل,5,Excellent service,Excellent service,4.706,,,
app_store,us,298867247.0,13505883317,2025-12-12T11:23:43-07:00,Radio Nacionales,5,Good,Todo bien gracias,4.706,,,
app_store,us,298867247.0,13505774147,2025-12-12T10:44:52-07:00,Sinkingmoonss,1,No Zelle option,App doesn’t have the option to find Zelle recipients from contacts. Makes it so you always have to manually input them in and it’s actually not easy or convenient at all.,4.706,,,
app_store,us,298867247.0,13505745937,2025-12-12T10:35:02-07:00,baq ma yizghoug,5,President Hadj Lakhdar Benzerrouki,"Thé Chase Bank app is very useful for comprehensive purposes ; 

Chase has being helping me assiduously send a monthly donation check to the Idriss Mosque( for upkeep and maintenance of the Mosque ) , in Northgate/Seattle / Washington , for almost twenty (20) years ;

Chase Bank offers very good service ;

I intend to ultimately expand  using the services like comprehensive investing and investments,that Chase offers 

Chard is a NON-NONSENSE Bank , that
caters to myriad financial 
needs and goals of anyone!


Hadj Lakhdar Benzerrouki",4.706,,,
app_store,us,298867247.0,13505724709,2025-12-12T10:27:38-07:00,Honney_luvv,1,Not helpful,Your dispute  department is bogus and not helpful,4.706,,,
app_store,us,298867247.0,13505395144,2025-12-12T08:39:57-07:00,James Pierpont Morgan,1,Fix the login and slow speed,I can’t login until 100 attempts and the speeds are prohibitively slow for loading searches,4.706,,,
app_store,us,298867247.0,13505095882,2025-12-12T07:09:28-07:00,Ray Irani,5,Excellent APP,Very easy to navigate and always up to date.,4.706,,,
app_store,us,298867247.0,13505087557,2025-12-12T07:07:05-07:00,Garrryb010,1,Horrible!,I have tried to use the deposit check feature on the app and it hasn’t worked for the last month Thanks for nothing Chase,4.706,,,
app_store,us,298867247.0,13504257795,2025-12-12T02:41:01-07:00,Rosaritijeras,5,Es muy buena,Nefertity,4.706,,,
app_store,us,298867247.0,13503065756,2025-12-11T17:29:25-07:00,Djm60805,1,Customer Service,"For the past three days I’ve been trying to fix a mistake Chase and Amazon made regarding an Amazon Visa that was created in error after being prompted to create a new account. Now I have a credit card I didn’t ask for, a new account I don’t want, and both Amazon and Chase are finger pointing at each-other as to who is to blame and can fix it. I can’t cancel the card as it will negatively impact my credit score, Chase says they can’t switch it to Prime Visa it has to be Amazon, who says it has to be Chase. This has been the worst experience I have ever had between two major corporations. Pathetic customer service, the people don’t even know their own products as they keep saying the two cards “are the same.”",4.706,,,
app_store,us,298867247.0,13503061977,2025-12-11T17:27:51-07:00,tarcheen,1,Cant see rewards points,"Its not visible how many points i accumulated for each card, very frustrating",4.706,,,
app_store,us,298867247.0,13502907151,2025-12-11T16:23:12-07:00,Sammy46054,5,Quick credit on dispute,I had a product I paid for that never arrived and Chase credited our account immediately. Thank you!,4.706,,,
app_store,us,298867247.0,13502519316,2025-12-11T13:42:52-07:00,21lady21lion,3,Call code and mobile code,"I hard get code very very big big problem!!!!!
I am deaf!!!!! Look you need add e-make
I can’t hear call and I not have mobile..",4.706,,,
app_store,us,298867247.0,13502341175,2025-12-11T12:32:33-07:00,LoyalCustomer208,1,Bad customer service,"I’ve been banking for years with Chase, and was scammed out of money. They refused to apply fraud protection to my account because I had purchased a cashiers check and they said it could not be recovered. They also charge a fee for a basic checking account which if you lose your job or have financial issues is basically a tax on the poor. Also they don’t offer a HYSA. Go to Capital One instead.",4.706,,,
app_store,us,298867247.0,13501958084,2025-12-11T10:11:47-07:00,12randyy,1,Too much garbage,"I DO NOT WANT TO OPEN ANOTHER ACCOUNT, I DO NOT WANT TO APPLY FOR A CREDIT CARD, I DO NOT WANT TO APPLY FOR FINANCING. ALL I WANT IS TO EITHER CHECK MY BALANCE OR DEPOSIT A CHECK",4.706,,,
app_store,us,298867247.0,13501664424,2025-12-11T08:33:28-07:00,Wilco Silent J,1,Mr,Your verification process is not very convenient.,4.706,,,
app_store,us,298867247.0,13501509826,2025-12-11T07:43:48-07:00,13 Meg,4,Service charge,"I think for senior citizens, you should wave the monthly service charge",4.706,,,
app_store,us,298867247.0,13501362315,2025-12-11T06:57:01-07:00,CassieSterling,1,Worst customer service,I’ve had more than a handful of issues at this bank. Customer service is horrible here. On more than one occasion they have allowed large transactions I do not recognize to go through & overdraw my account. Customer service is never any help. I’ve had to pay for stop payments etc dealing with this bank. Today I will be choosing to finally close my account.,4.706,,,
app_store,us,298867247.0,13500947041,2025-12-11T04:45:12-07:00,Jbecky02,5,Navigation,This website is so easy to navigate.  All info is easily accessible. Very easy to move from one account to another,4.706,,,
app_store,us,298867247.0,13500784159,2025-12-11T03:48:20-07:00,mocofarmgirl,5,mocofarmgirl,Very friendly helpful staff.   Appreciate it being where I can walk to.,4.706,,,
app_store,us,298867247.0,13499970764,2025-12-10T21:31:45-07:00,Avant 1,2,Fees,Have multiple accounts with Chase and they continue to charge a monthly service fee not happy about that. Been with Chase for years now.,4.706,,,
app_store,us,298867247.0,13499870259,2025-12-10T20:42:29-07:00,Herbietheiceman,1,Slow,This app need a good update more feature more sensory,4.706,,,
app_store,us,298867247.0,13499731164,2025-12-10T19:38:16-07:00,Ale_gtaz,1,Deposit,So fair it’s one of my worse experiences with banks I can’t believe that for a single check they’re taking 9 days to make it available and it’s not the first time that they do this even if you called support they gonna tell you they can’t do anything about it,4.706,,,
app_store,us,298867247.0,13499433792,2025-12-10T17:34:38-07:00,DidntGetMe,1,So many pop ups,The user experience is ruined by too many popups. I logged in 2mon ago and have gotten nothing but popup after popup. Not even sure this is the last one… just following your popup to rate my user experience. So there it is!,4.706,,,
app_store,us,298867247.0,13499171130,2025-12-10T15:47:54-07:00,amjice,2,SMS 2FA Still?,"Great app overall but its potential vulnerability is a doozy.  When everyone else is using a more secure mechanism for 2FA – app-based or passkeys – Chase continues with the weakest form of 2FA: even NIST doesn’t like it.  Get with the program, Chase!",4.706,,,
app_store,us,298867247.0,13498948594,2025-12-10T14:17:55-07:00,Ascension2heaven,5,Deposit checks,When choosing to deposit a check the screen stays black on my end not showing anything at all I thought it was a bug that was happening to me turns out my co workers are also experiencing the same thing I told my wife is her is working she said hers is fine I guess a few people was affected by it but please fix it,4.706,,,
app_store,us,298867247.0,13498598628,2025-12-10T12:06:11-07:00,Sylvn04,5,Love my Chase app,Easy and fast! Sending money at the touch of a finger! Notifications are helpful to keep track of your account,4.706,,,
app_store,us,298867247.0,13497955519,2025-12-10T08:29:48-07:00,kekesteto,5,Done right....,The Chase mobile app is probably the best app in its category. Managing the financial account is easy and it works flawlessly. It's a well designed app with end users in mind.,4.706,,,
app_store,us,298867247.0,13497881462,2025-12-10T08:06:37-07:00,刷雪球,1,What kind of GREAT feature needs IOS16？,"Well, to me, Chase is just simple book-keeping and I didn’t see why it has to use GREAT features from iOS16? Did the guys who write the code really understand what’s the meaning of backward compatibility???",4.652,,,
app_store,us,298867247.0,13497641952,2025-12-10T06:52:52-07:00,plantainbwoy,5,Easy to use,I really like the chase app. Very easy to use and very convenient and secure. I love it. Highly recommended.,4.706,,,
app_store,us,298867247.0,13497588119,2025-12-10T06:36:25-07:00,never paypal,4,Great service,Always take good care of me ! Both at at local level and online/phone/customer service!!,4.706,,,
app_store,us,298867247.0,13497390338,2025-12-10T05:36:09-07:00,QuizzicalKid,2,Personal Notes are poorly implemented.,"The personal notes you place on transactions so that you can personally identify them (especially if the account is shared with a spouse) are not visible or searchable from the account transaction page.  You have to go Account Transfers, NOT intuitive, and VIEW (expand)  every transaction one by one to find what you are looking for.  A major issue if you are searching through prior months.  The feature was not thought out very well.",4.706,,,
app_store,us,298867247.0,13495851655,2025-12-09T18:45:24-07:00,Adisgruntleduser,1,Gets you into Dante’s circles of hell - impossible to set up,"To set up the app, after you’ve already set up an online account, you need to call a number to request a code. Instead of a straightforward system, you get into an artificially incompetent version of Dante’s Inferno. Impossible to actually get this code. Never mind that my phone is already registered to receive codes for the website interface, so sending this code to my registered phone should be straightforward. Whoever programmed this wins the award for most clueless person who ever roamed the earth.",4.704,,,
app_store,us,298867247.0,13495687140,2025-12-09T17:39:30-07:00,Nana EJA,5,Customer,Great Service!  Thank you!,4.704,,,
app_store,us,298867247.0,13495675720,2025-12-09T17:34:59-07:00,hefzi-ba.,5,Recomendación,Super recomendable a mi me a funcionado muy bien y siempre resuelven cualquier duda o problema.,4.704,,,
app_store,us,298867247.0,13495379441,2025-12-09T15:36:26-07:00,Eatmytuchus,1,Charge for Hotel,This was a HORRIBLE experience. I showed proof that I contacted the company and they never got back to me. The hotel reservation was during a Nor’easter which was too dangerous to travel in. Now I’m ou the money for a service I never used. I’m currently looking for another bank!! VERY disappointed and I feel taken advantage of!,4.704,,,
app_store,us,298867247.0,13495126249,2025-12-09T13:57:40-07:00,Tom23555,1,Worst app ever,Makes you call them for verification every time,4.704,,,
app_store,us,298867247.0,13493858074,2025-12-09T06:49:58-07:00,Fulani to,5,The best,Chase has the super service and security system.,4.704,,,
app_store,us,298867247.0,13491923541,2025-12-08T17:33:12-07:00,jawstand,2,So many updates,Not happy,4.704,,,
app_store,us,298867247.0,13491155479,2025-12-08T12:31:19-07:00,ecoboost_jesse,5,⭐ Chase Bank Review,"I’ve been using Chase for banking and the mobile app, and overall it’s been a pretty solid experience. The app makes it easy to check my balance, transfer money, and use Zelle when I need to send or receive cash quickly. Mobile check deposit is convenient too no need to go to the bank in person.

I like that Chase has a lot of ATMs and branches around my area, so it’s easy to get help or withdraw money when I need to. Everything is pretty organized and reliable for everyday banking.",4.704,,,
app_store,us,298867247.0,13490842676,2025-12-08T10:39:28-07:00,Banks Suk,1,ALL Banks Suck,I should have the right to pay in any fashion I choose to pay without you dictating my choices.  Your power is slowly coming to an end.  I can’t wait for blockchain solutions………,4.704,,,
app_store,us,298867247.0,13490806964,2025-12-08T10:27:06-07:00,lisaloudittle,1,Zelle won’t work.,M.,4.704,,,
app_store,us,298867247.0,13490757872,2025-12-08T10:10:31-07:00,ABran114,1,They will hold your money with no reason,"I paid off the entire balance f my card expecting to be able to use what I paid off like every other card I have used, leaving me with no money in bank account. 5 days later my available credit hasn’t updated but the balance says zero and they pulled the money out of my account. I call them and they said sometimes they hold the money and that it would be a few more days. Very frustrating not being able to know when or not that will happen. This caused me to miss bill payments",4.704,,,
app_store,us,298867247.0,13490654928,2025-12-08T09:36:31-07:00,TGM!!,1,Signing in,"I can’t sign in. It keeps saying , It looks like this part of our site is not working right now.",4.704,,,
app_store,us,298867247.0,13490642900,2025-12-08T09:32:33-07:00,ibelgod12,5,Great,"Love the App is quick, easy to access and able to understand .",4.704,,,
app_store,us,298867247.0,13490621397,2025-12-08T09:25:49-07:00,Stones 75,1,Too many adds,"I just want to use the app to manage my money, not get bombarded with a hundred offers.",4.704,,,
app_store,us,298867247.0,13490539189,2025-12-08T09:00:19-07:00,Kchaz12,5,Everything you need,For our mortgage management - it’s all I need to make changes and keep tabs on things. Very smooth and intuitive app.,4.704,,,
app_store,us,298867247.0,13490527921,2025-12-08T08:56:50-07:00,egnaty,5,Chase App!!,"Great tool for everyday use. Ease of use. Bundles all your bills on one page. Never had an issue while using. Would give 5 more stars if able too. Keep up the good work. 
I have used many other payment apps. But you need to be a rocket scientist to navigate through them!!",4.704,,,
app_store,us,298867247.0,13489993796,2025-12-08T06:11:23-07:00,EatAdick420,4,Nice app.,Not to bad of an app. Makes it easy to control and pay my card. Wish it would process payment i make to my card faster.  Untill they adapt crypto paying i guess that cant be chainged,4.704,,,
app_store,us,298867247.0,13489442709,2025-12-08T03:09:08-07:00,Clary💕,5,Atención al cliente,Súper rápidos y amables,4.704,,,
app_store,us,298867247.0,13489407656,2025-12-08T02:55:15-07:00,需要汉语版的APP,5,"You need Mandarin support, and you need the ability to deposit checks directly with photos.","You need Mandarin support, and you need the ability to deposit checks directly with photos.",4.704,,,
app_store,us,298867247.0,13488921392,2025-12-07T23:12:52-07:00,alng129,1,Crashing,App crashes when trying to view Redeemed Chase Offers. Please fix!,4.704,,,
app_store,us,298867247.0,13488899162,2025-12-07T23:02:10-07:00,LavonBeauty,5,Easy to use,"I love this app, it helps with everything you need!",4.704,,,
app_store,us,298867247.0,13488841595,2025-12-07T22:33:46-07:00,APG389,5,Card Replacement,You should be able to put in whatever Shipping Address Necessary. It should never be Locked. God Bless Chase Bank.,4.704,,,
app_store,us,298867247.0,13488500940,2025-12-07T19:52:41-07:00,Play On 04,1,Connection errors.,Constant connection errors in the net worth section. Every single day there is another issue. Chase has lost all quality. Customer service is so so bad. You out the offers below all the transactions now. I hate having to scroll so far. Redeemed offers no longer appear. Also no way to show I’m going to another country and card gets flagged. No way to fix it. Phone service is terrible. Help! Net worth accounts keep having connection issues. Terrible customer service.,4.704,,,
app_store,us,298867247.0,13487470078,2025-12-07T13:09:29-07:00,Abasvil,5,Confiabilidad,"Tanto la gerencia de Chase como sus trabajadores tienen un profesionalismo único , inspirador de confianza y seguridad en todos tus trámites gracias.",4.704,,,
app_store,us,298867247.0,13487392020,2025-12-07T12:42:42-07:00,SSCalab,5,Happy customer,Always a pleasure being a Chase customer. Thank you,4.704,,,
app_store,us,298867247.0,13487348128,2025-12-07T12:27:53-07:00,No es sufíente,5,👌,Es buena y de paso simple de aprender,4.704,,,
app_store,us,298867247.0,13486851448,2025-12-07T09:54:10-07:00,MaxAgHammer,1,Terrible app,"Information presented within this app is terribly organized. Just a blizzard of ads and promotions and services littered about on every page. A zillion nested menus with a zillion selections buried inside.

When something breaks with your Chase account … and it probably will … you will have a devil of a time trying to fix it using this app.

For some reason I can no longer see my linked non-Chase checking account whenever I try to redeem rewards points. It used to be there, and Chase customer service operators can “see” it, but the app doesn’t list it at all. No one knows why. Just a complete mess from a TBTF monster.",4.704,,,
app_store,us,298867247.0,13486634505,2025-12-07T08:51:41-07:00,Laloege,1,Balance not clear,They make it really hard to know the real balance at moment compared to Bank of America which is very transparent,4.704,,,
app_store,us,298867247.0,13485990872,2025-12-07T05:50:32-07:00,DuBois117,1,Bad transfer,Not a bad app. But I did transfer 50$ 3 times last month. One of the 50$ just vanished. My savings show to loose 50$ 3 times. And my checking only got 50$ 2 times. And can’t contact a person to assist with this.,4.704,,,
app_store,us,298867247.0,13485469743,2025-12-07T03:00:28-07:00,Farida Abbasi,5,Easy to use,The user interface of this application is awesome. Easy to use and easy to navigate.,4.704,,,
app_store,us,298867247.0,13484948861,2025-12-06T23:33:19-07:00,Roxyd91,5,Great app,"Amazing and seamless app that keeps me up-to-date on everything that I’ve purchased, the hotel and flight aspect of it can sometimes be a little tough, but that’s pretty much the only thing I can think of that is anywhere close to a negative!",4.704,,,
app_store,us,298867247.0,13484070030,2025-12-06T17:43:32-07:00,Fresnette,1,Quite frustrating!,I am finally giving up- it asks for information and I give it. Then it asks for it again- can’t get through all the steps,4.704,,,
app_store,us,298867247.0,13483836267,2025-12-06T16:16:42-07:00,tchatham,5,Good service,Very good and fast service,4.704,,,
app_store,us,298867247.0,13483660270,2025-12-06T15:09:32-07:00,Donieka11111,1,Don’t bank with chase,DO NOT BANK with Chase ! They closed my account and restricted it do to making transactions to Cash App that I’ve made they closed my account with no hesitation I’ve been with this bank for a few years never would I thought that they would close an entire,4.704,,,
app_store,us,298867247.0,13483178172,2025-12-06T12:15:02-07:00,Celebrating 80 tears,1,Frustrated 😡,Denied mobile deposit,4.704,,,
app_store,us,298867247.0,13482687810,2025-12-06T09:41:31-07:00,XPD314,2,Why?,"Why, suddenly it says, “validate your account and phone number. It hasn’t been used for 11 months.”  I’ve probably used it 15 times in the last 11 months.",4.704,,,
app_store,us,298867247.0,13481877477,2025-12-06T05:57:49-07:00,hairdok,1,Late fee on credit card,Late fee charges are astronomical not worth it when other credit card companies are cheaper apr and less late fees,4.704,,,
app_store,us,298867247.0,13480351811,2025-12-05T20:28:55-07:00,Cornfed Hoss,5,Best,This is simply the best bank with the best customer service,4.704,,,
app_store,us,298867247.0,13479851552,2025-12-05T17:19:52-07:00,Culebraperversa,5,Deposit,Always easy to use and faster efficient way to manage your money,4.704,,,
app_store,us,298867247.0,13479620195,2025-12-05T15:53:31-07:00,Kamran Z,4,Mobile App,It does not show transaction debited balance available,4.704,,,
app_store,us,298867247.0,13479577532,2025-12-05T15:37:07-07:00,kaixluvsxsai,1,Pushed me out,"Would be nice if updates didn’t push me out of using the service. It’ll tell me to update past what my phone can. I get it, my phone is old. But my app worked fine before.",4.652,,,
app_store,us,298867247.0,13479446250,2025-12-05T14:46:39-07:00,Ray4rail,1,Today I removed you from my Amazon default card,"Ever since the last update with your and Amazon’s app, both apps have not been working together well. I would’ve given you higher star rating. Because you used to be able to click on what you purchased and what you were being charged for in your app directly to the Amazon purchase that I made they matched, and I would be happy. But now since the update you click the link on the Chase app. Me to Amazon to my orders. It doesn’t really tell me there was a specific one. To get together and fix your apps and then I will come back and give you a higher star rating. But for right now, I’m not using my Amazon credit card app until it’s fixed.",4.704,,,
app_store,us,298867247.0,13479400040,2025-12-05T14:28:46-07:00,suj.m,5,Nice app!,"Neat app, easy to browse, clear data, good colors and fast processing!!",4.704,,,
app_store,us,298867247.0,13479337273,2025-12-05T14:04:51-07:00,RussellGentry,5,New Member,"Got hooked up with a Checking/Savings Account.
Great job on 
Los Osos, Ca. Chase Bank.",4.704,,,
app_store,us,298867247.0,13478849769,2025-12-05T11:05:08-07:00,Past love1260,1,No option to provide feedback,There is no option to provide feedback on sapphire lounge experience.   Getting into sapphire lounge in Las Vegas is a mess.   Why do we pay 800$ a year to find out we cannot get into the lounge.  This feels like a waste of money.,4.704,,,
app_store,us,298867247.0,13478727769,2025-12-05T10:22:37-07:00,CarrTA,1,Doesn’t work.,Is everyone else not able to login? Sure I can call their help line. If I want to wait 30 minutes just to talk to someone then to be transferred to someone else who usually cannot fix the problem and asks me moronic questions like “do you have the right password”,4.704,,,
app_store,us,298867247.0,13478701099,2025-12-05T10:13:45-07:00,Lucy22341987,5,Excellent,Good,4.704,,,
app_store,us,298867247.0,13478045516,2025-12-05T06:52:25-07:00,Kchiro2,5,Fast and easy,I really love banking with Chase mobile. Easy and uncomplicated,4.704,,,
app_store,us,298867247.0,13478038730,2025-12-05T06:50:25-07:00,Armandov2022,1,Account cancelación,They canceled my account for no reason,4.704,,,
app_store,us,298867247.0,13477817521,2025-12-05T05:46:01-07:00,Comeriano,5,Easy to use,Chase app easy to use! Thank you,4.704,,,
app_store,us,298867247.0,13477693803,2025-12-05T05:09:12-07:00,Abckshdhevsms,1,App season logs in correctly -,Not good,4.704,,,
app_store,us,298867247.0,13477591460,2025-12-05T04:37:34-07:00,FOXtheTranscedent,4,Different UX for Credit & Debit Accounts,The app is good. Small gripe is that the search feature between a cc and debit account are wildly different. Don’t understand the reasoning.,4.704,,,
app_store,us,298867247.0,13476938086,2025-12-05T00:23:15-07:00,philiparcturus,5,Account management,"Always excellent customer service
Fast transfers from investment to checking account",4.704,,,
app_store,us,298867247.0,13476140746,2025-12-04T18:18:08-07:00,Zenco03,1,Overcharged,Being overcharged for overdraft fees,4.704,,,
app_store,us,298867247.0,13476034774,2025-12-04T17:35:15-07:00,ToreanTt,1,Account Closure,Chase closed my account for no reason whatsoever.,4.704,,,
app_store,us,298867247.0,13475875673,2025-12-04T16:30:44-07:00,TransTex,3,Mixed feelings.,Most aspects of the app are nice but the delays in posting charges and payments in credit card accounts can be confusing. There must be a better way!,4.704,,,
app_store,us,298867247.0,13475291792,2025-12-04T12:36:19-07:00,layla dog,5,Great,Great,4.704,,,
