platform,storefront,app_id,review_id,date,user,rating,title,review,version,package,thumbsUpCount,appVersion
app_store,us,298867247.0,13444313411,2025-11-26T11:53:59-07:00,LtSmokeS13,5,Great service,Always fast and friendly assistance whenever I need it . As well as great customer support and services all the time. So glad I switched to chase bank ! Thank you all !,4.702,,,
app_store,us,298867247.0,13444120835,2025-11-26T10:49:16-07:00,Alex the lions,5,Easy to use,Information about the account well explained !,4.702,,,
app_store,us,298867247.0,13443678576,2025-11-26T08:29:42-07:00,Sablazo,5,Mi Banco Favorito,Me gusta los servicios y la atencion que tienen    Y que me cobran el interés justo.,4.702,,,
app_store,us,298867247.0,13443664153,2025-11-26T08:25:19-07:00,OxBarcexO,5,Great service,Awesome service,4.702,,,
app_store,us,298867247.0,13443589320,2025-11-26T08:02:35-07:00,Refuntime,1,Interest,"They are very deceptive with the way they accumulate, disclose and charge you interest.",4.702,,,
app_store,us,298867247.0,13443368671,2025-11-26T06:56:31-07:00,Yannisellers,5,I heart Jamie Dimon,"Jamie is amazing he’s the greatest CEO in financial history. If I could work for anybody, I’d want to work for Jamie diamond. If I could be as smart as anybody, I’d wanna be as smart as Jamie Dimon",4.702,,,
app_store,us,298867247.0,13441836810,2025-11-25T20:47:06-07:00,DahGurl4310,5,Easy to Navigate,I’ve been a chase member for years. The online app is just as effective as the face-to-face service.,4.702,,,
app_store,us,298867247.0,13441705747,2025-11-25T19:46:23-07:00,grace7999,5,Useful,It’s really easy to use and manage the payments.,4.702,,,
app_store,us,298867247.0,13441292923,2025-11-25T16:53:37-07:00,deadheadfol,5,Almost perfect,Chase is great just wish there was an option to borrow against your direct deposit,4.702,,,
app_store,us,298867247.0,13440897829,2025-11-25T14:10:51-07:00,Biagio Black,5,Great UX,Easy to use for stocks and investing,4.702,,,
app_store,us,298867247.0,13440865656,2025-11-25T13:58:22-07:00,shoptalula,4,Due Date?,I was send by email a reminder that my Chase Prime card was due in 2 days but that is not the case at all.,4.702,,,
app_store,us,298867247.0,13440780436,2025-11-25T13:25:27-07:00,married20,5,Transfer,100,4.702,,,
app_store,us,298867247.0,13440744032,2025-11-25T13:11:48-07:00,marina_del_reyview,1,Mr_Guidry,Your system is trash,4.702,,,
app_store,us,298867247.0,13440668922,2025-11-25T12:44:48-07:00,Just_23,1,Crashing,"App has been acting crazy lately. It keeps logging me completely out. It’s annoying. What’s the purpose of Face ID if every time I log in I still need to put in my password, then wait for text verification etc. I’m so annoyed!",4.702,,,
app_store,us,298867247.0,13440445046,2025-11-25T11:27:24-07:00,Victoriapayne232,1,Credit score,I can’t see my credit score,4.702,,,
app_store,us,298867247.0,13439887080,2025-11-25T08:28:23-07:00,tony malleo,1,Banks are awful,To have money in a savings account you charge to just have it sit there. You are a thief. Wish you all collapsed during the Great Depression. The world would be better off without Jp Morgan chase,4.702,,,
app_store,us,298867247.0,13439672322,2025-11-25T07:23:12-07:00,MoAhmed2022,1,Issues and errors,I regret having an investment account with Chase and soon I will transfer my money somewhere else. It’s slow and always errors and I couldn’t use my own money to replace a buy order just stupid app.,4.702,,,
app_store,us,298867247.0,13439084127,2025-11-25T04:21:35-07:00,1000eyesphotography,2,Account previews,The account preview was my single most use feature. Bring it back please,4.702,,,
app_store,us,298867247.0,13437946867,2025-11-24T20:03:08-07:00,183 s,5,Seriously good job,Customer service is great with easy to navigate website,4.702,,,
app_store,us,298867247.0,13437908110,2025-11-24T19:45:54-07:00,Susa46,5,No need to panic🫤,Move dollars from one account to another easy as pie😊,4.702,,,
app_store,us,298867247.0,13437887952,2025-11-24T19:37:07-07:00,Lovedana Antoine,5,Lovedana,"Chase is one of the best Bank, that’s one of the bank that really knows how to take care of its customers. I love everything about Chase Bank.",4.702,,,
app_store,us,298867247.0,13437589969,2025-11-24T17:34:59-07:00,November24.25,1,Fees,Your fees are customer abuse,4.702,,,
app_store,us,298867247.0,13436759373,2025-11-24T12:16:42-07:00,Fraud fees,1,Fees,Chase puts holds on your check deposits to charge the monthly service fee,4.702,,,
app_store,us,298867247.0,13436224077,2025-11-24T09:21:28-07:00,东方焦,5,👍👍👍,服务非常好,4.702,,,
app_store,us,298867247.0,13436026843,2025-11-24T08:20:51-07:00,PackersFan3720,1,Trash,Don’t use.,4.702,,,
app_store,us,298867247.0,13435678719,2025-11-24T06:35:52-07:00,J2332md,1,Disputes,If you file disputes with them half the time they are rude and “unable” to help ! They will reverse your account to negative credit and say they cant do anything even if you have a card stolen and claim it as fraud be ware of thus situation!! Horrible bank !!!!!,4.702,,,
app_store,us,298867247.0,13435228061,2025-11-24T04:14:52-07:00,Rizzata,1,Predatory,"Forgot my credit card payment wasn’t on auto pay. Remembered 5 days late to make my $40 minimum payment, except the day after my payment was due they charged me a $40 late fee on top of that. A 100% late fee charged the DAY AFTER a payment is due with no reminders????? Will be paying off this card and never using Chase again.",4.702,,,
app_store,us,298867247.0,13435061623,2025-11-24T03:15:24-07:00,Ben-iPad,5,Good job!,Thank you!,4.702,,,
app_store,us,298867247.0,13434606637,2025-11-23T23:50:25-07:00,LoveTheMoon,1,Frustrated,"Every time I use this app, I have to change the password. It works after that. The next time I try to use this app with that new password, it doesn’t recognize it, and I have to get a new password. It’s frustrating.  The Discover app works so much better. So after I post this review, I’ll use the telephone instead of the app to pay my bill. That always works.

Update: I still have the same problem. Every single time I use this app, it does not recognize my password. This is beyond STUPID. I should just delete this app.",4.702,,,
app_store,us,298867247.0,13434213362,2025-11-23T20:36:34-07:00,Shuntata,1,De-banks Legit Customers while supporting criminals,Don’t bother with chase. They will close your account just because you want to use self sovereign money.,4.702,,,
app_store,us,298867247.0,13433870719,2025-11-23T18:06:08-07:00,burgess landscaing!!,1,Worst bank,I deposited a 2k check and this bank has the check cleared and will not give me access to my funds.,4.702,,,
app_store,us,298867247.0,13433831609,2025-11-23T17:49:54-07:00,16982,1,Can’t detect fraud for anything,Legitimately useless.,4.702,,,
app_store,us,298867247.0,13433216180,2025-11-23T13:38:29-07:00,Clásico🙌🏽👌🏽,5,Excelente servicio y protección 👌🏽💪🏽,Lo más confiables,4.702,,,
app_store,us,298867247.0,13432462155,2025-11-23T09:23:35-07:00,Rick Bongsmoke,1,Withdrew from my savings twice,Chase withdrew my credit card balance twice and is taking 5-7 days to send a refund. I closed all my accounts as a result.,4.702,,,
app_store,us,298867247.0,13432376724,2025-11-23T08:57:42-07:00,I like chase bank,5,Best banking,Best banking,4.702,,,
app_store,us,298867247.0,13432366023,2025-11-23T08:54:28-07:00,14pofe,1,App Bug,"Since 11/20/25 i have trouble accessing the menu and lock/unlock card(it shows up as a blank white page). i reinstalled app 5 times, updated ios and nothing works. the app has bug issues that need to be fixed",4.702,,,
app_store,us,298867247.0,13432324094,2025-11-23T08:41:46-07:00,Grammy's race car,5,Rewards are great!,"I love using my Prime
Card at Amazon! Getting 5% off on all Amazon purchases is greatly appreciated.",4.702,,,
app_store,us,298867247.0,13432252363,2025-11-23T08:20:28-07:00,bohorquez,5,Excellent fraud protection,Twice Chase alerted me of possible fraud. Both times it was.,4.702,,,
app_store,us,298867247.0,13431777239,2025-11-23T06:00:59-07:00,Mrfreedman,2,Glitches out and items are not easily found.,"You have to really search for certain things or to preform tasks that make sense to have on that page, but are located deep in the app such as locking or unlocking the card. The app is glitching out and will not allow you to turn on notifications for your cards",4.702,,,
app_store,us,298867247.0,13431558101,2025-11-23T04:53:33-07:00,2037753154,5,Chase Online Banking,Chase Online Banking makes my bill paying so easy.  Especially those bills that have the same amount due each month.,4.702,,,
app_store,us,298867247.0,13431121539,2025-11-23T02:14:36-07:00,Michael12$$,2,So hard to find letters you sent,Why is it so difficult to find the letters? Why can’t you just put it in the email so I don’t have to look everywhere all over the app to find the letter?,4.702,,,
app_store,us,298867247.0,13430679555,2025-11-22T23:08:00-07:00,$$$ travel,3,Not there yet,App continues to need work. Isn’t real feature rich and lacks.,4.702,,,
app_store,us,298867247.0,13430508538,2025-11-22T21:49:38-07:00,mr columbia,1,harasses me until i write a review,app bad. here's the review,4.702,,,
app_store,us,298867247.0,13429859604,2025-11-22T17:19:14-07:00,Mlađoni,5,Graetest,Very very great bank and customer support team,4.702,,,
app_store,us,298867247.0,13429323104,2025-11-22T13:41:43-07:00,BrandyChandler,1,No chase bank,"I’m a long time Chase account holder. I recently moved to Corpus Christi Texas. Yes, this is in America and one of the largest banks in America doesn’t have a location branch or ATM that I can access my account. It’s the most ridiculous thing I’ve ever heard of.",4.702,,,
app_store,us,298867247.0,13429242680,2025-11-22T13:10:50-07:00,NetTQ,2,Would be a 5,"This review would be a 5, but Chase is requiring my family to go through lengthy and costly probate proceedings because of a technicality which was caused by an error on their system processes.  It is indisputably clear to them who the money belongs to, and since it was actually Chase’s fault in the first place, they really should have just given us the money and written it off.  It’s not much to Chase, but makes a difference to us.",4.702,,,
app_store,us,298867247.0,13429089532,2025-11-22T12:14:09-07:00,Krispykritter1,1,Card Lock,"Today I accidentally tried to charge something with my card lock on.  I realized it after my card declined, but then when I tried again with it off it still declined my card!  I still have $1500 left I could charge so what gives?",4.702,,,
app_store,us,298867247.0,13428987279,2025-11-22T11:37:59-07:00,Lion be,5,No complaints,So far it’s going well,4.702,,,
app_store,us,298867247.0,13428619627,2025-11-22T09:36:53-07:00,"njll;l;l,nj",1,Horrible customer support,"Trying to remove a old phone number a work phone number from my account and I can’t find any place to do it. Can’t get a hold of us Customerservice. The chat wants me to change my regular phone number even though I asked for the secondary phone number. Overall, Chase is really failing in the customer support area",4.702,,,
app_store,us,298867247.0,13428563403,2025-11-22T09:19:41-07:00,susieQ0610,2,Very disappointed,Someone got into my son’s computer and was able to steal our money. Chase did not help us because it said it came from one of our devices. We told them someone hacked the computer and they still refuse to return the money.,4.702,,,
app_store,us,298867247.0,13428350837,2025-11-22T08:16:29-07:00,NotHappy!25,1,Auto loan balance not available,I have wasted the last half hour trying to use the app to find my balance for my Chase auto loan. Chase has lost all accountability and customer service like every other cooperation. I wish I could just save my money under my mattress like the good ole days.,4.702,,,
app_store,us,298867247.0,13427714797,2025-11-22T05:12:46-07:00,arhegazy,1,Many issues with the investment accounts on phone,"1. It doesn’t allow you to choose which tax lot to sell
2. Stop orders and stop limit orders do not work
3. Many mutual funds aren’t available for self-directed accounts
4. Even on PC, you cannot choose a tax lot to sell by a limit order.

And there is more …",4.702,,,
app_store,us,298867247.0,13427048095,2025-11-22T01:11:30-07:00,Cash B.,2,Needs more,Wish I got paid 4 days early like Wells Fargo customers do.,4.702,,,
app_store,us,298867247.0,13426969748,2025-11-22T00:39:11-07:00,JayDave96,5,Best App and Staff Ever,Speaks for itself. Very handy tool most times. 9/10,4.702,,,
app_store,us,298867247.0,13426333645,2025-11-21T19:57:11-07:00,mikemikemike105,1,No,Horrible customer service and no use for your money to grow,4.702,,,
app_store,us,298867247.0,13426037791,2025-11-21T17:58:24-07:00,Turbo lift,5,Helping,Taking business,4.702,,,
app_store,us,298867247.0,13425591630,2025-11-21T15:01:40-07:00,La mejoooooorrrrr,5,The best app,The best app,4.702,,,
app_store,us,298867247.0,13425234826,2025-11-21T12:40:22-07:00,NickNameMeBotOK,1,Chase supports Epstein,Did you know that Chase CEOs worked directly with Jeffry Epstein to clean his 🍇money??? That’s so interesting. Use a credit union. Also this app is whatever.,4.702,,,
app_store,us,298867247.0,13424785179,2025-11-21T09:59:15-07:00,Cvvvvvvvvvvvn,1,Apple Compatibility,Face ID and Photo options aren’t usable. I hate that I have to search online to get this app to work properly.,4.702,,,
app_store,us,298867247.0,13424628899,2025-11-21T09:07:45-07:00,Fkeoso,5,Wire transfer international,Fast transaction,4.702,,,
app_store,us,298867247.0,13424374091,2025-11-21T07:48:07-07:00,21mariol,1,Worst experience ever,I need to go from the bank because the call center doesn’t help me,4.702,,,
app_store,us,298867247.0,13424157206,2025-11-21T06:42:45-07:00,betifisendagoodreveiw,1,dont like it,"I locked this card out and I’m paying it off month at a time. I don’t like the fact that it takes three or four days for it to show up as paid when I do a payment. I don’t like the fact that I pay every month always more than you request but yet every month you send me a bill I’ve never missed a payment never I pay it the first of every month always do always have and you’re gonna do this. No this card is a pain and I as soon as I pay this card off, I’m canceling it. Also, this has the highest interest rates of any of my cards.",4.702,,,
app_store,us,298867247.0,13424082821,2025-11-21T06:20:33-07:00,MannyG 12,5,Great service,Very easy to navigate able to take care of tasks quickly and efficiently.,4.702,,,
app_store,us,298867247.0,13424080848,2025-11-21T06:19:59-07:00,Unleashed24000,1,Dumb,You charge me just to have a bank with you and you charge me for everything possible. the true criminals are these banks,4.702,,,
app_store,us,298867247.0,13423647119,2025-11-21T04:05:34-07:00,Nhöj,5,The best service,"Have been with them since 2017, the most secured & trusted!",4.702,,,
app_store,us,298867247.0,13423245098,2025-11-21T01:28:33-07:00,Melliyou,5,Very good service,Customer service,4.702,,,
app_store,us,298867247.0,13422566117,2025-11-20T20:04:48-07:00,Retired Navy 2005,5,Chase App,I’ve been a cardholder for years. I enjoy being able to open up the app to make payments and check my credit score if needed.,4.702,,,
app_store,us,298867247.0,13422453712,2025-11-20T19:14:38-07:00,MónicaV 77,5,Chase is the best!,Best technology and services.,4.702,,,
app_store,us,298867247.0,13422297334,2025-11-20T18:09:23-07:00,dhawani,5,Well designed,Great user experience,4.702,,,
app_store,us,298867247.0,13422282015,2025-11-20T18:03:05-07:00,@_marcospolos_,5,Bank rating,Pending payments never take too long so I can always get an accurate amount in my bank. 👍🏼,4.702,,,
app_store,us,298867247.0,13422039812,2025-11-20T16:23:40-07:00,jian hou,5,Banks,Great service,4.702,,,
app_store,us,298867247.0,13421641697,2025-11-20T13:39:31-07:00,Anyeluchy,5,Excellent,Es un banco increíble estoy seguro que es el mejor banco que eh tenido en mi vida te resuelven cualquier duda inmediatamente por eso le doy 5🌟,4.702,,,
app_store,us,298867247.0,13421511807,2025-11-20T12:48:34-07:00,713boy,5,J,Best bank I have ever had,4.702,,,
app_store,us,298867247.0,13421267646,2025-11-20T11:17:32-07:00,Me to know,1,Won’t open,Wont open and have never been able to use uninstalled reinstalled still nothing say temporary unavailable very frustrating had to mail a check which defeats purpose of the app,4.702,,,
app_store,us,298867247.0,13421125858,2025-11-20T10:27:25-07:00,Ligantmsk,1,Can’t get one-time app code,"I received a new card by mail. I installed the app and received a message asking me to confirm my identity. But I can't receive a one-time code either by text or by phone. I thought it was a one-day issue (due to heavy traffic), but four days have passed and the problem persists. As a result, I can't verify my identity in the app.",4.702,,,
app_store,us,298867247.0,13421088229,2025-11-20T10:14:25-07:00,djgynee,5,Chase App,"I have many apps on my phone for different things, including businesses and banking and I have to say honesty. The Chase app is the easiest to navigate. There’s nothing that’s hidden or difficult to find everything is transparent and easy to understand. This is by far the most user-friendly consistently reliable app I have on my phone",4.702,,,
app_store,us,298867247.0,13420870903,2025-11-20T09:01:36-07:00,Ramy.planck,4,Font,"The app is really fast and smooth, but I wish the amount “number” of each transaction was written in a bolder font, so that it can stand out form the rest of the writings in the transaction section.",4.702,,,
app_store,us,298867247.0,13420819809,2025-11-20T08:44:47-07:00,Easier to call the restaurant,1,Not receiving push notifications,"I’m trying to log into my account and the app is not giving me the push notifications required to access my account online.  How to make something very simple, difficult. Check.",4.702,,,
app_store,us,298867247.0,13420530961,2025-11-20T07:13:42-07:00,loquinha751,5,Very good,Nice,4.702,,,
app_store,us,298867247.0,13420275994,2025-11-20T05:55:09-07:00,Seventy4blazer,1,No widget,It’s 2025. Get a widget.,4.702,,,
app_store,us,298867247.0,13419756980,2025-11-20T03:00:23-07:00,Alejandro_em1sv,5,Easy to use,Great app,4.702,,,
app_store,us,298867247.0,13419297646,2025-11-19T23:32:17-07:00,Naiiirito,5,Mi mejor opción,Excelente servicio al cliente y sus productos 100% garantizados,4.702,,,
app_store,us,298867247.0,13419200333,2025-11-19T22:44:28-07:00,fuzykiller,5,Chase App,Very easy to use!!!!,4.702,,,
app_store,us,298867247.0,13419172255,2025-11-19T22:30:53-07:00,Pb Zeppelin,1,Chase Funded Ep-stein,"They helped him support the whole island and traffic people around the globe. Also, they just want your money. They don’t care about YOU in the slightest",4.702,,,
app_store,us,298867247.0,13418650557,2025-11-19T18:28:21-07:00,Jenjenraven,3,Statement access poor,"Since Chase, like all banks these days, is so eager to save themselves money by not mailing statements, you would think they would at least be easy to find on the app. When you go to a specific credit card account, there are lots of options, but viewing your statement statements is not one of them. If you know where to look, you can go all the way back to the homepage, and pull up a menu from which you can see statements for all the different Chase accounts, but it is not obvious. It’s a bit circuitous. Also, I did not see a way to open a CD from the app.",4.702,,,
app_store,us,298867247.0,13418638038,2025-11-19T18:23:09-07:00,quero aprender de la biblia,5,Chase,Es buen vasco le de las cuentas  es un buen bando informa todo,4.702,,,
app_store,us,298867247.0,13418343872,2025-11-19T16:20:45-07:00,Robertadeng,5,As Advertised!,I’ve been using Chase Mobile for some time now and it works flawlessly with no glitches. Much easier to use and to set up than my previous mobile app with Fifth Third.,4.702,,,
app_store,us,298867247.0,13418003950,2025-11-19T13:58:16-07:00,Leo.com1,5,Me encanta,Me encanta,4.702,,,
app_store,us,298867247.0,13417983731,2025-11-19T13:50:03-07:00,Cvee1,1,Re,Worst experience ever after years with chase no help someone did fraud in my account and chase wants me to pay back the money I never saw when they locked my account and etc never going back to chase.,4.702,,,
app_store,us,298867247.0,13417912901,2025-11-19T13:21:42-07:00,I_Sunk_Your_Ship,5,I have 2 Chase Cards,Both cards work awesome for different reasons ! I have never had any issues with working with Chase Banking would highly recommend!,4.702,,,
app_store,us,298867247.0,13417902809,2025-11-19T13:17:45-07:00,Onomatopoeia iching jeun,5,Thanksgiving for 4+ age rating,Again thanks,4.702,,,
app_store,us,298867247.0,13417621245,2025-11-19T11:30:58-07:00,Kksmith2,5,They take care of everything,I just started using a payment app and Chase made it so easy. They are always there to help and make things easier. Thank you,4.702,,,
app_store,us,298867247.0,13417109117,2025-11-19T08:35:51-07:00,Touring Musican 101,1,Rasied Annual Fee for no reason!,Would close out altogether after rate increase but will just limit use to once a year.,4.702,,,
app_store,us,298867247.0,13416655124,2025-11-19T06:13:40-07:00,Addiactive,5,Owner,"Very easy to navigate through the different accounts you may have, and so many tools,",4.702,,,
app_store,us,298867247.0,13416452402,2025-11-19T05:11:19-07:00,MT71985,5,Good app,UI and screen navigation is easy to use. Never have had a problem.,4.702,,,
app_store,us,298867247.0,13416107764,2025-11-19T03:13:51-07:00,GregBrad,5,Great card for Me,"I’ve found that with the perks and cash back I get from Amazon, this Chase Prime card is saving me money.",4.702,,,
app_store,us,298867247.0,13415519801,2025-11-18T22:47:06-07:00,404.5,5,Easy and convenient,I can do it for you and you can do it with me and I can pay you for the money I don’t have to do anything for it but,4.702,,,
google_play,us,,91afeb76-73b3-41b5-ae3e-97bd0f595f46,2025-12-29 14:54:15,Thomas Brooks,1,,My debit card has not arrived and been past the time my military pay us nt been deposited nor pending yet and mypay said the sent it bank putting bad taste in my mouth and ain't been with them long this bank take so long deposited you money it ridiculous it like the bank run on dictorship chime and other credit union out do this bank by a mile if could give 0 i would right now,,com.chase.sig.android,1.0,4.704
google_play,us,,ad79481d-809a-47a2-b546-b54f81d51510,2025-12-29 13:23:05,MtnDew in the RazorBack,5,,love it,,com.chase.sig.android,0.0,4.704
google_play,us,,58820836-a149-4cbc-a42f-100d12d23896,2025-12-29 12:14:40,Celeste Dawkins,5,,im not able to access my account,,com.chase.sig.android,0.0,4.704
google_play,us,,bf47b924-86d0-45f4-b42a-9fe3691a1c35,2025-12-29 05:42:04,Rose,5,,love the rewards,,com.chase.sig.android,0.0,4.704
google_play,us,,1601a598-8731-4b32-9226-5c7516a898e2,2025-12-29 04:39:57,Rachel Van Brunt,1,,not opening not loading erased by accident and sign in is blocked. chase mobile,,com.chase.sig.android,0.0,4.704
google_play,us,,54dd1275-52f8-47da-8455-ba7323be75da,2025-12-29 02:20:45,Wellington mendoza,5,,it's all good 👍🏼😊,,com.chase.sig.android,0.0,4.704
google_play,us,,cbc0ff25-dff5-49d5-8ef7-c978fbe6ab8d,2025-12-29 01:29:16,Pancho Martinez,5,,nada mas Tengo problemas cuando olvidado la contraseña pero todos muy bueno,,com.chase.sig.android,0.0,4.704
google_play,us,,c55130e3-2028-4dd2-959d-d536b7bae813,2025-12-29 00:45:26,Ethan H,1,,"I want to quickly check my balance frequently, the app is useless if I need to re-log in every time I open it. Mobile apps cannot be inconvenient like that.",,com.chase.sig.android,0.0,4.704
google_play,us,,aeab36c6-60ca-4820-89e6-7e2bb5f94ea2,2025-12-29 00:15:36,Vince McCarty,5,,the cash back is awesome,,com.chase.sig.android,0.0,4.704
google_play,us,,996ff486-09a6-4f51-a07b-1ef585e0f015,2025-12-28 23:01:10,Danielle Whitcomb,5,,great can't complain......,,com.chase.sig.android,0.0,4.704
google_play,us,,da5cf47a-30e1-446b-9cca-45773ed3080b,2025-12-28 21:22:16,Jake Bayers,2,,"The app is well, okay. i would like to see when I pay.I should be able to use my card correctly. and not wait 3 to 4 days for my payment to go through. once I pay it should be immediately active. not waiting.",,com.chase.sig.android,0.0,4.704
google_play,us,,efa85ec4-5248-464a-8098-432396a6138b,2025-12-28 20:19:35,Lydia Arteaga,4,,Great,,com.chase.sig.android,0.0,4.662
google_play,us,,2bc36f50-54e0-4646-862e-e43070c98936,2025-12-28 20:13:42,Otha Greer,5,,Great! well it was great until CHASE upgraded their system and my device is no longer compatible with their system!!! Any suggestions would be appreciated!!!,,com.chase.sig.android,0.0,4.321
google_play,us,,6a18e934-1e15-445d-832d-2314fa1a600a,2025-12-28 18:58:47,Sam Martin,2,,can I set privacy? I don't like this.,,com.chase.sig.android,0.0,4.704
google_play,us,,a363bb92-fea9-4b0f-9329-a07c12ecbc9c,2025-12-28 18:56:52,Dennis Harrell,1,,I expect my devices to be able to use my saved passwords. Not allowing this is utter incompetence.,,com.chase.sig.android,0.0,4.704
google_play,us,,c4049051-e569-4efd-9620-155ce8ff3804,2025-12-28 17:48:31,Robert K,1,,"Pretty good app but a few times a week it just says, ""this application is experiencing technical difficulties "", or something to that effect. So frustrating. I just think that one of the best banks in the world should have a more reliable app. UPDATE: I have to change my rating to one star. Just trying to redeem my rewards points it's amazing the hoops you have to jump through just to get money transferred from one account to another to verify my identity.",,com.chase.sig.android,2.0,4.704
google_play,us,,153362d2-b2d4-466e-a2d6-a0e4d23eb98e,2025-12-28 16:54:31,dolores garcia,5,,gracias por la gran protection al usually y exelente services 👏🏽 😀,,com.chase.sig.android,0.0,4.704
